id,description
368,"Pack vest - Everyone knows the best spots are beyond where crowds are willing to go - the Pack Vest helps you get there with everything you need. This award-winning modular design combines a cool-wearing mesh vest with a fishing-specific, multiuse daypack; a detachable harness allows vest and pack to be used separately. The vest is cut short for deep wading and has a rod holder, accessory D-rings, piggyback tool pockets and reach-across zippered pockets. It also connects to the Stormfront Pack harness. The pack features a floating baffle internal divider, large external mesh pocket with drainholes, water-resistant zippers, breathable 3-D spacer mesh back panel and shoulder straps, built in rod-tube holder and a mesh water-bottle pocket. Vest pockets are now made from 100% nylon, while the pack is built with tough polyester (47% recycled) double-weave fabric. Vest sternum strap and pack compression buckles have been upgraded to low-profile Duraflex Stealth-V buckles for smoother function and easier adjustment.<br><br><b>Details:</b><ul> <li>""Polyester mesh vest and 300-denier polyester double-weave pack work together or separately; comes with detachable, adjustable harness for use without pack; vest will also connect to the Stormfront Pack harness""</li> <li>""Vertical pocket configuration, front pockets have reach-across, zippered access, separate piggyback tool pocket, drain holes; inverted hemostat pocket, accessory D-rings, rod holder, foam fly patch, two glasses loops""</li> <li>""Vest sternum strap buckle has been upgraded to the adjustable and quick-release DuraFlex Stealth-V buckle for smoother function, lower profile and easy adjustment; cut short for deep wading""</li> <li>""Pack: 3-D spacer-mesh pads the ergonomic back panel and anatomically curved shoulder strap; Two main compartments with DWR (durable water repellent) coated, water resistant  zippers, divided by floating baffle, outside mesh pocket with three grommet drainholes, small top pocket, mesh water bottle pocket""</li> <li>""Front compression strap buckles have been upgraded to the adjustable and quick-release DuraFlex Stealth-V buckle for smoother function, lower profile and easy adjustment; two compression straps, two lash points for securing a rod-tube""</li> <li>Pack panel sleeve for hydration reservoir</li> <li>Patent number 5639005</li></ul><br><br><b>Fabric: </b>""Vest: 4.6-oz 100% polyester mesh. Pockets: 4.3 oz 100% nylon. Pack: 300-denier 100% polyester (47% recycled) double weave with polyurethane coating. Lining: 200-denier polyester with polyurethane coating. Straps/Back panel: polyester 3D spacer mesh. Vest, pockets, lining and pack all have DWR finish""<br><br><b>Weight: </b>(1021 g 35.4 oz)<br><br>Made in Vietnam."
369,"Stand up shorts-5 in. - They've been around for 30-plus years, re-envisioned, reincarnated, tweaked over, tinkered with and constantly improved. Yet the more we change them, the more they stay the same. Stand-Up Shorts are made from rugged 10-oz 100% organic cotton to thwart climbing's abusive tendencies. The hardworking canvas softens and personalizes with age. Doubled fabric in the seat increases durability and forms two rear pockets; a set-in pocket holds a wallet. Inseam (size 32) is 5"". Garment-washed for softness and minimal shrinkage. Recyclable through the Common Threads Recycling Program.<br><br><b>Details:</b><ul> <li>Durable organic cotton canvas will soften and personalize with age; double seat for abrasion resistance in rough terrain</li> <li>Zip fly with button closure</li> <li>Quarter-top front pockets; hook-and-loop back pockets; separate inset hook-and-loop security pocket</li></ul><br><br><b>Fabric: </b>10-oz 100% organic cotton canvas. Recyclable through the Common Threads Recycling Program<br><br><b>Weight: </b>(409 g 14.2 oz)<br><br>Made in Thailand."
370,"Stand up shorts-7 in. - They've been around for 30-plus years, re-envisioned, reincarnated, tweaked over, tinkered with and constantly improved. Yet the more we change them, the more they stay the same. Stand-Up Shorts are made from rugged 10-oz 100% organic cotton to thwart climbing's abusive tendencies. The hardworking canvas softens and personalizes with age. Doubled fabric in the seat increases durability and forms two rear pockets; a set-in pocket holds a wallet. Inseam (size 32) is 7"". Garment-washed for softness and minimal shrinkage. Recyclable through the Common Threads Recycling Program.<br><br><b>Details:</b><ul> <li>Durable organic cotton canvas will soften and personalize with age; double seat for abrasion resistance in rough terrain</li> <li>Zip fly with button closure</li> <li>Quarter-top front pockets; hook-and-loop back pockets; separate inset hook-and-loop security pocket</li></ul><br><br><b>Fabric: </b>10-oz 100% organic cotton canvas. Recyclable through the Common Threads Recycling Program<br><br><b>Weight: </b>(432 g 15 oz)<br><br>Made in Thailand."
371,"Sticks 'n stones morocco poster - Patagonia Rock Ambassador Brittany Griffith and Jonathan Thesenga on the approach to Tout Pour Le Club (IV 5.12d). High Atlas Mountains, Morocco. For 30 years we've paid tribute to human adventures both near and far with a collection of photographs that speak to the passion, joy and beauty of lives spent outside. These photos have appeared exclusively on our Web site, in our catalog and on the walls of our retail stores and specialty outdoor clothiers around the world. And now we are excited to make select photos available to you as posters. We hope they brighten up your space and inspire you to get outside.<br><br><b>Details:</b><ul> <li>Dimensions: 24 x 36</li> <li>""Photo by Andrew Burr ?2009 Patagonia, Inc.""</li></ul><br><br><b>Fabric: </b>Printed with soy inks on 100% recycled paper<br><br>Printed in USA."
372,"Peregrine t-shirt - A born wanderer, the once-endangered Peregrine Falcon now soars wave thermals in habitats the world over. The Peregrine T-Shirt features original artwork by Nick Wroblewski on a canvas of 100% organic cotton. Ringspun fabric yarns and taped shoulder seams lend a soft hand. PVC- and phthalate-free inks are easier on the environment. The shirt is Recyclable through the Common Threads Recycling Program.<br><br><b>Details:</b><ul> <li>Ringspun yarns for a softer hand</li> <li>Taped shoulder seams</li> <li>Screen-print inks are PVC- and phthalate-free</li></ul><br><br><b>Fabric: </b>5.4-oz 100% organic cotton. Recyclable through the Common Threads Recycling Program<br><br><b>Weight: </b>(199 g 6.9 oz)<br><br>Made in USA."
373,"Permit silhouette t-shirt - The Permit's scythe-shaped dorsal fin propels the saltwater lover across the flats of the Permit Silhouette T-Shirt. Printed on organic cotton (100%) fabric with inks that are PVC- and phthalate-free, the tee has ringspun yarns for softness. Taped shoulder seams lend a durable, clean finish. Recyclable through the Common Threads Recycling Program.<br><br><b>Details:</b><ul> <li>Ringspun yarns for a softer hand</li> <li>Taped shoulder seams</li> <li>Screen-print inks are PVC- and phthalate-free</li></ul><br><br><b>Fabric: </b>5.4-oz 100% organic cotton. Recyclable through the Common Threads Recycling Program<br><br><b>Weight: </b>(199 g 6.9 oz)<br><br>Made in USA."
374,"Pique fleece 1/4 zip - Made from plush textured fleece, the classic Pique 1/4-Zip has raglan sleeves and wears like a favorite old sweatshirt. Great for casual wear or as an active layering piece. The 100% polyester piqu? knit fleece is soft and warm, and contrast Supplex nylon reinforces the collar for extra durability. We added a left-side zippered security pocket to keep keys and phone handy. Recyclable through the Common Threads Recycling Program.<br><br><b>Details:</b><ul> <li>""Soft, 100% polyester piqu? knit face; fleece interior""</li> <li>Supplex reinforced collar</li> <li>Left-side zippered security pocket</li></ul><br><br><b>Fabric: </b>6-oz 100% polyester fleece. Trim: Supplex 100% nylon. Recyclable through the Common Threads Recycling Program<br><br><b>Weight: </b>(346 g 12 oz)<br><br>Made in Vietnam."
375,"Pique vitaliti polo shirt - The perfect summer fabric to keep your back from sticking to the seat. The pique polo's forward-thinking blend of 6.5-oz 70% organic cotton and 30% all-recycled polyester also wicks moisture during long walks beneath the Flatirons, highball V4s at Flagstaff and hardcore sodbusting sessions in your own back yard.<br><br><b>Details:</b><ul> <li>""Lightweight, quick-to dry organic cotton/recycled polyester fabric in a piqu? knit""</li> <li>Hidden snap-front placket</li> <li>Side vents</li></ul><br><br><b>Fabric: </b>6.5-oz 70% organic cotton/30% all-recycled polyester piqu??. Recyclable through the Common Threads Recycling Program<br><br><b>Weight: </b>(262 g 9.1 oz)<br><br>Made in Thailand."
376,"Polo shirt - Pulling on a polo opens the door to possibilities - the look gets you past people who enforce regulations, and the feel puts plans in motion. Ours has a hefty, 7.2-oz organic cotton fabric in a piqu? knit that keeps its casual composure (and bolsters yours), even when the occasion requires a steady smile or enclosed footwear. With a soft, athletic collar and a low-profile placket for increased durability over its long life. Recyclable through the Common Threads Recycling Program.  <br><br><b>Details:</b><ul> <li>Organic cotton piqu?</li> <li>Taped neck; frame-knit collar and cuffs</li> <li>3-button placket</li> <li>Taped side vents</li></ul><br><br><b>Fabric: </b>7.2-oz 100% organic cotton piqu?. Recyclable through the Common Threads Recycling Program<br><br><b>Weight: </b>300 g (10.6 oz)<br><br>Made in China."
377,"Quiet please t-shirt - Thoreau said that ""silence is the universal refuge""   a sentiment made clear with the Quiet Please T-Shirt. Illustrated by the art team Heads of State, the tee has an inside message about Snowlands Network(SaveOurSnowlands.org), a group leading the charge to keep our winter wild lands serene preserving and protecting them for low-impact users. The shirt is recyclable through the Common Threads Recycling Program.<br><br><b>Details:</b><ul> <li>Ringspun yarns for a softer hand</li> <li>Taped shoulder seams</li> <li>Screen-print inks are PVC- and phthalate-free</li></ul><br><br><b>Fabric: </b>5.4-oz 100% organic cotton. Recyclable through the Common Threads Recycling Program<br><br><b>Weight: </b>(175 g 6.1 oz)<br><br>Made in USA."
378,"R1 full-zip jkt - It stretches, breathes, wicks, and warms - no wonder so many serious trail and mountain athletes use and abuse our R1. And the full-zip front makes it even more versatile, from a midlayer in winter to a lightweight jacket on early spring mornings and alpine summer evenings. The high/low interior grid polyester enhances compressibility, airflow, insulation and dry time, and the jersey microfiber face allows smooth layering. Two zippered handwarmer pockets sit above the harness line and have glued-in (no seams) internal mesh pocket bags. Recyclable through the Common Threads Recycling Program.<br><br><b>Details:</b><ul> <li>""Versatile R1 fleece provides excellent stretch, warmth, wicking and breathability in a variety of temperatures""</li> <li>""High/low interior grid-structure enhances compressibility, airflow and dry time""</li> <li>Jersey microfiber face allows nonbinding layering</li> <li>Center-front zipper</li> <li>Handwarmer pockets</li></ul><br><br><b>Fabric: </b>R1: 6.5-oz Polartec Power Dry 93% polyester (60% recycled)/7% spandex. Recyclable through the Common Threads Recycling Program<br><br><b>Weight: </b>357 g (12.6 oz)<br><br>Made in Colombia."
379,"Lw guide pants - A backcountry version of our immensely popular Simple Guides, the Lightweight Guide Pants combine skiing and alpine climbing features with a lightweight, free-moving and highly breathable 4-way stretch-woven fabric. They resist moisture and provide mountain-worthy durability, and the fit allows for spring-weight underlayers on those brisk alpine starts. Reinforced, articulated knees enhance mobility, while the zippered and gusseted cuffs adjust to various boot girths, have a snap closure, and feature tie-down loops as well as crampon/ski edge scuff guards. With a zippered fly, belt loops and pockets (two hand, one glued-on right thigh) that close with laser-cut, glued-in zippers. Recyclable through the Common Threads Recycling Program.<br><br><b>Details:</b><ul> <li>Lightweight 4-way stretch-woven polyester double weave with DWR (durable  water repellent) finish; separated zip waist (not pull-on)</li> <li>Belt loops; partial elasticized waistband</li> <li>""Zip fly; pockets: two zippered hand, one zippered thigh, right glued-on thigh""</li> <li>Hand and thigh zips are laser-cut and glued; reinforced knees to resist abrasion</li> <li>Articulated knees; crampon/ski-edge scuff guard</li> <li>Zippered and snap gusset with full gripper elastic</li> <li>Tie-down loops at ankle cuffs</li></ul><br><br><b>Fabric: </b>6.2-oz 91% all-recycled polyester/9% spandex double weave with Deluge DWR (durable water repellent) finish. Recyclable through the Common Threads Recycling Program<br><br><b>Weight: </b>405 g (14.3 oz)<br><br>Made in Thailand."
380,"Lw r4 jkt - High off the deck on Warbonnet Peak in the immaculate Wind River Mountains, the naming of the range quickly makes sense. Our windproof and stretchy Lightweight R4 Jacket protects and warms with a Polartec Windbloc laminate sandwiched between a low-nap polyester microfleece face and a high/low grid polyester interior. Unlaminated R1 underarm panels (60% recycled polyester) enhance breathability and mobility, while a neck gasket seals out the elements. Seamless shoulders allow pack-wearing comfort. With three external pockets (the handwarmers stay clear of your harness), one internal drop-in pocket and a drawcord hem. Recyclable through the Common Threads Recycling Program.<br><br><b>Details:</b><ul> <li>""Lightweight, durable low-nap microfleece face""</li> <li>Full-stretch Polartec Windbloc laminate</li> <li>R1 interior-grid construction speeds wicking</li> <li>Nonlaminated R1 fabric under the arms enhances mobility and breathability</li> <li>Drawcord collar with Supplex stand; protective chin flap for comfort; seamless shoulders for comfort under a pack</li> <li>""Pockets: two handwarmers, one chest and two internal drop-in""</li> <li>Drawcord hem</li></ul><br><br><b>Fabric: </b>Lightweight R4 shell: 8-oz Polartec Windbloc 100% polyester microfleece laminated to R1 Polartec Power Dry polyester. R1 panels: 6.5-oz Polartec Power Dry 93% polyester (60% recycled)/7% spandex. Recyclable through the Common Threads Recycling Program<br><br><b>Weight: </b>467 g (16.5 oz)<br><br>Made in Colombia."
381,"R2 jkt - A modern mountain staple, the adaptable R2 Jacket serves as a stand-alone outer layer when you're on the go or as a superb insulating layer under a shell. The stretchy polyester knit uses variable-length fibers to optimize insulation and compressibility while affording outstanding breathability, warmth, moisture-management and minimal weight. Stretchy R1 fabric (made with 60% recycled polyester) inside the collar and cuffs enhances skin comfort, and the pliable R2 body fabric means you'll move easily. With an easy-to-use front zipper, glued-in zippered pockets (one chest and two handwarmers) and forward-set shoulder seams for pack-wearing comfort. Recyclable through the Common Threads Recycling Program.<br><br><b>Details:</b><ul> <li>""Highly technical R2 fabric is light, stretchy and compressible, with great breathability""</li> <li>""Insulating long fibers alternate with dense, supportive short fibers to optimize insulation and reduce bulk""</li> <li>Directional knit wicks moisture and speeds dry time</li> <li>Inner collar lined with R1 fabric (made with recycled polyester) for next-to-skin comfort; collar and protective chin flap lined with R1 fabric (made with recycled polyester) for next-to-skin comfort</li> <li>Low-bulk R1 fabric cuffs</li> <li>Pockets: one chest and zippered handwarmers; zippers all welded and reinforced with Supplex for snag-free operation</li> <li>Shoulder seams set forward for pack-wearing comfort</li></ul><br><br><b>Fabric: </b>R2 shell: 7.4-oz Polartec Thermal Pro 100% polyester (40% recycled) fleece. R1 panels: 6.5-oz Polartec Power Dry 93% polyester (60% recycled)/7% spandex. Recyclable through the Common Threads Recycling Program<br><br><b>Weight: </b>419 g (14.8 oz)<br><br>Made in Colombia."
382,"Rain shadow jkt - Staying inside isn't the only way to stay dry - enjoy the trails in all conditions with fully seam-sealed waterproof/breathable protection. The Rain Shadow is made from a packable, lightweight and tear-resistant 2.5-layer 100% nylon fabric with a waterproof/breathable H2No barrier and a Deluge DWR (durable water repellent) finish. On the inside, a raised pattern diffuses and channels moisture away from skin, aids in hassle-free layering, and enhances long-term durability. Updated with microfleece lining on the neck and chin, waterproof handwarmer pockets (no longer mesh-lined) with zipper garages, and external zippers that are now water-resistant (without storm flaps). Also features a roll-down, 2-way-adjustable, helmet-compatible hood, a 2-way center-front zipper, self-fabric cuff tabs and a drawcord hem.<br><br><b>Details:</b><ul> <li>""2.5-layer tear-resistant fabric with a waterproof/breathable H2No barrier and a Deluge DWR (durable water repellent) finish; highly engineered interior surface texture channels moisture away from skin, protects the waterproof barrier from abrasion and slides easily over layers""</li> <li>""Roll-down, 2-way-adjustable hood with a laminated visor for improved hood structure and visibility in poor conditions""</li> <li>Microfleece-lined neck and chin for comfort and enhanced protection of barrier</li> <li>""All exterior zippers (center front, handwarmer pockets and pit zips) have a water-resistant  coating to keep you dry without extra storm flaps and hook-and-loop closures""</li> <li>Waterproof handwarmer pockets - without mesh lining</li> <li>Updated custom zipper pulls</li> <li>""Low-profile, laminated self-fabric cuff tabs; drawcord hem""</li></ul><br><br><b>Fabric: </b>""2.5-layer, 2.5-oz 100% nylon with a waterproof/breathable H2No barrier and Deluge DWR finish""<br><br><b>Weight: </b>(331 g 11.5 oz)<br><br>Made in Vietnam."
383,"Lw everyday socks - An essential part of the daily grind, these exceptionally soft, wearable socks have an inviting mix of 55% organic cotton/40% stretch nylon/5% spandex for moisture-wicking next-to-skin comfort. An open grid over the top of the foot and a looped Lintoe construction combine to create excellent airflow for breathability and kick-your-feet-up foot comfort. The jersey-knit cuff extends to mid-calf; height is 9.5"".<br><br><b>Details:</b><ul> <li>Organic cotton and nylon blend is ideal for everyday use</li> <li>""Fabric content and strategic knit balance moisture wicking, cushioning, durability and comfort""</li> <li>An open grid over top of foot allows excellent airflow and breathability</li> <li>Looped Lintoe construction creates the smallest and flattest seam possible for ultimate toe comfort</li></ul><br><br><b>Fabric: </b>55% organic cotton/40% nylon/5% spandex<br><br><b>Weight: </b>(49 g 1.7 oz)<br><br>Made in USA."
384,"Lw guide pants - A backcountry version of our immensely popular Simple Guides, the Lightweight Guide Pants combine skiing and alpine climbing features with a lightweight, free-moving and highly breathable 4-way stretch-woven fabric. They resist moisture and provide mountain-worthy durability, and the fit allows for spring-weight underlayers on those brisk alpine starts. The gusseted crotch and reinforced, articulated knees allow unrestrained mobility, while the zippered and gusseted cuffs adjust to various boot girths, have a snap closure, and feature tie-down loops as well as crampon/ski edge scuff guards. With a 2-way zip fly, belt loops and pockets (two hand, one glued-on right thigh) that close with laser-cut, glued-in zippers. Recyclable through the Common Threads Recycling Program.<br><br><b>Details:</b><ul> <li>Lightweight 4-way stretch-woven polyester double weave with DWR (durable water repellent) finish; gusseted crotch</li> <li>Separated zip waist (not pull-on); Belt loops</li> <li>""2-way zip fly; pockets: two zippered handwarmers, one zippered thigh, right glued-on thigh""</li> <li>Zippers: hand and thigh are laser cut and glued</li> <li>Reinforced knees to resist abrasion; articulated knees</li> <li>Crampon/ski-edge scuff guard; zippered and snap gusset with full gripper elastic</li> <li>Tie-down loops at ankle cuffs</li></ul><br><br><b>Fabric: </b>6.2-oz 91% all-recycled polyester/9% spandex double weave with Deluge DWR (durable water repellent) finish. Recyclable through the Common Threads Recycling Program<br><br><b>Weight: </b>439 g (15.5 oz)<br><br>Made in Thailand."
385,"Lw hiking crew liner socks - Liners take the brunt of our rambles. They add lightweight warmth in cold conditions, reduce chafing when paired with a sock, and keep feet dry and cool when worn solo in sweltering weather. Made from a jersey-knit construction of 60% polyester (100% recycled) with 37% nylon for superior moisture transport, quick-drying performance and absolute durability; 3% spandex provides shape retention and give; looped Lintoe construction provides added comfort. Height is 9.5"".<br><br><b>Details:</b><ul> <li>Lightweight polyester and nylon blend strategically knit for excellent wicking and a speedy dry time</li> <li>Looped Lintoe construction creates the smallest and flattest seam possible for ultimate toe comfort</li></ul><br><br><b>Fabric: </b>60% all-recycled polyester/37% nylon/3% spandex<br><br><b>Weight: </b>(40 g 1.4 oz)<br><br>Made in USA."
386,"Storm light jkt - An emerging classic, inspired by the original Storm Jacket and holding true to timeless traits: It's waterproof, breathable and comfortable. Built for warm-weather use and engineered to be recycled at the end of its days, the Storm Light keeps you dry and in motion - from lowland treks to high-mountain passes. Full waterproof/breathable protection combines with a hanging mesh and taffeta liner for a soft, pliable, comfortable feel. Storm flaps cover the pit zips, the three external zippered pockets and the center-front 2-way zipper. Other details include a soft chamois chin guard, a 2-way-adjustable hood that rolls down into the microfleece-lined collar, an internal drop-in pocket and a drawcord hem. Cuffs secure with self-fabric tabs. Recyclable through the Common Threads Recycling.<br><br><b>Details:</b><ul> <li>2-layer polyester fabric with waterproof/breathable H2No barrier and a hanging mesh-and-taffeta liner for greater comfort</li> <li>2-way-adjustable and stowable hood</li> <li>Soft chamois chin guard</li> <li>""Storm flaps on center-front zipper, pit zips, and external pocket zippers""</li> <li>""Pockets: one external left chest, two handwarmers, one internal drop-in""</li> <li>Cuffs secure with self-fabric tab</li> <li>Drawcord hem</li></ul><br><br><b>Fabric: </b>""Shell: 2-layer, 75-denier 3.8-oz 100% polyester laminate with a waterproof/ breathable H2No barrier and Deluge DWR (durable water repellent) finish. Shell lining: 2.9-oz 100% all-recycled polyester mesh. Hood lining: 2.3-oz 50-denier 100% all-recycled polyester taffeta. Collar lining and chin flap: 5.5-oz 100% polyester brushed-jersey. Recyclable through the Common Threads Recycling Program""<br><br><b>Weight: </b>(689 g 23.9 oz)<br><br>Made in China."
387,"Stretch ascent jkt - Simple, stretchy, lightweight and waterproof. Made for alpine climbs where the realities include sideways-blowing sleet, our Stretch Ascent Jacket provides full stormproof protection and extraordinary breathability. The stretch-woven polyester (100% recycled) and waterproof/breathable barrier combine in a pliable 2.5-layer fabric package that enables your most limber moves. The roll-down, helmet-compatible hood adjusts in three ways with an easy-to-use single-pull system. A water-resistant, coated center-front zipper remains easy to open and close, the water-resistant external pocket zippers have zipper garages, and the third pocket is an internal drop-in. Cuffs secure with self-fabric tabs, and the hem's drawcord routes through the pockets. The hood's structured visor improves visibility in poor conditions. Recyclable through the Common Threads Recycling Program.<br><br><b>Details:</b><ul> <li>""H2No waterproof/breathable, 2.5-layer stretch-woven shell""</li> <li>""Helmet compatible, roll-down, single-pull 3-way adjustable hood with laminated visor""</li> <li>Front zipper offers extreme water resistance and easy zipping</li> <li>""Pockets: two PU-zippered handwarmers with zipper garages, one internal drop-in""</li> <li>Cuffs secure with self-fabric hook-and-loop cuff closures</li> <li>Hem drawcord routed through pockets</li></ul><br><br><b>Fabric: </b>""2.5-layer, 50-denier 4.1-oz 100% all-recycled stretch-woven polyester with a waterproof/breathable H2No barrier and Deluge DWR (durable water repellent) finish. Recyclable through the Common Threads Recycling Program""<br><br><b>Weight: </b>476 g (16.8 oz)<br><br>Made in Vietnam."
