id,description
249,"Simply organic tank - Summer tanks take a beating; freshen up last year's crop with the Simply Organic Tank, now available in prints and solids. Wear the tank day or night, alone or layered, all year long. The organic cotton jersey has a natural stretch; the feminine scoop with a mini-placket and pearl buttons zest up the front. Recyclable through the Common Threads Recycling Program.<br><br><b>Details:</b><ul> <li>Organic cotton jersey</li> <li>4-button placket; binding around neck and sleeves</li> <li>Straight hem with side vents</li></ul><br><br><b>Fabric: </b>4.5-oz 100% organic cotton jersey. Recyclable through the Common Threads Recycling Program<br><br><b>Weight: </b>(109 g 3.8 oz)<br><br>Made in Thailand."
250,"Simply organic tee - The Simply Organic Tee survives tough scrapes year after year, making it a perennial favorite. Made from soft organic cotton, the shirt layers beautifully and has form-flattering features like feminine crewneck styling and cap sleeves cut on the bias for great fit - all of which set it apart from the standard T-shirt crowd. Recyclable through the Common Threads Recycling Program.<br><br><b>Details:</b><ul> <li>Organic cotton jersey</li> <li>Bias-cut for drape and contouring</li> <li>Overlock stitching at neck and arm holes for added appeal</li></ul><br><br><b>Fabric: </b>4.5-oz 100% organic cotton jersey. Recyclable through the Common Threads Recycling Program<br><br><b>Weight: </b>(115 g 4 oz)<br><br>Made in Thailand."
251,"Simply organic top - When Spring's first blossoms cover the hills, venture out in the lively Simply Organic Top.  The scoop-necked shirt is made from 100% organic cotton jersey and is bias cut for drape and contouring. Its three-quarter-length sleeves have cuff vents for mobility; overlock stitching at neck and arm holes add appeal. Recyclable through the Common Threads Recycling Program.<br><br><b>Details:</b><ul> <li>Organic cotton jersey</li> <li>Bias-cut for drape and contouring</li> <li>Overlock stitching at neck and arm holes for added appeal</li> <li>3/4-length sleeves with cuff vent for mobility</li></ul><br><br><b>Fabric: </b>4.5-oz 100% organic cotton jersey. Recyclable through the Common Threads Recycling Program<br><br><b>Weight: </b>144 g (5.1 oz)<br><br>Made in Thailand."
252,"Solid boucau halter top - The Boucau has soft ties at the neck and back that adjust for a personalized fit. A wide underbust band offers ample support; contouring darts add shape. With removable soft pads and a smooth lining for a clean look. Made from a blend of 82% nylon/18% spandex.<br><br><b>Details:</b><ul> <li>Soft ties around neck and back</li> <li>Lined front</li> <li>""Wide, elastic supportive band under bust""</li> <li>Contouring darts add shape</li> <li>""Removable, side-entry soft cups""</li> <li>Improved fabric</li></ul><br><br><b>Fabric: </b>5.6-oz 82% nylon/18% spandex<br><br><b>Weight: </b>(57 g 2 oz)<br><br>Made in USA."
253,"Solid kupala top - Our fixed triangle bikini top, the Kupala, has adjustable crossover ties that cinch down and keep it all together under pressure. Small pleats add shaping. The lined front has removable soft pads. Made from a durable blend of 82% nylon/18% spandex.<br><br><b>Details:</b><ul> <li>Fixed triangle swim top with adjustable ties that crossover at back</li> <li>Lined front</li> <li>Center pleats add shape</li> <li>""Removable, side-entry soft cups""</li></ul><br><br><b>Fabric: </b>5.6-oz 82% nylon/18% spandex<br><br><b>Weight: </b>(57 g 2 oz)<br><br>Made in USA."
254,"Solid paries btm - The boy-short-style Paries Bottoms fit low and straight across the hips. With wide sides for comfort, a lined front and full seat coverage. Made from our improved fabric blend of 82% nylon/18% spandex.<br><br><b>Details:</b><ul> <li>Boy-short style</li> <li>Lined front</li> <li>Fits low and straight across hips</li> <li>Updated waist styling</li> <li>Medium coverage in front; full back coverage</li> <li>Improved fabric</li></ul><br><br><b>Fabric: </b>5.6-oz 82% nylon/18% spandex<br><br><b>Weight: </b>(54 g 1.9 oz)<br><br>Made in USA."
255,"Solid sunamee btm - Stay-put Sunamees fit straight across the hips, with full coverage in back. Lined front. Made from a formfitting blend of 82% nylon/18% spandex.<br><br><b>Details:</b><ul> <li>Full coverage</li> <li>Lined front</li> <li>Fits straight across hips</li> <li>Regular rise</li> <li>Improved fabric</li></ul><br><br><b>Fabric: </b>5.6-oz 82% nylon/18% spandex<br><br><b>Weight: </b>(43 g 1.5 oz)<br><br>Made in USA."
256,"Solimar skirt - The Solimar is a brief and sassy wrap skirt with built-in shorts; just enough skirt for school, just enough short for recess. The ultralight, tightly woven nylon stretch fabric blocks UV rays (30 UPF) and has a DWR (durable water repellent) finish to repel water. The shorts have an interior center-front zip while the skirt wraps over with button closures - one on the inside and one on the outside. The cleanly finished skirt has welted front patch pockets and a thigh mini drop-in pocket. Waist-to-hem length is 16"" (size 8); built-in shorts inseam is 3"". Recyclable through the Common Threads Recycling Program.<br><br><b>Details:</b><ul> <li>Lightweight stretch fabric with 30-UPF sun protection and DWR (durable water repellent) finish</li> <li>Wrap skirt with built-in shorts</li> <li>Shorts have zip fly with slide closure; skirt wraps closed with 2 buttons</li> <li>Patch front pockets with welt openings; mini drop-in pocket on right thigh</li> <li>Back dart for shaping</li> <li>""Length 16"""" from waist to hem; shorts 3"""" inseam""</li></ul><br><br><b>Fabric: </b>3-oz 93% nylon/7% spandex with 30-UPF sun protection. Recyclable through the Common Threads Recycling Program<br><br><b>Weight: </b>(222 g 7.7 oz)<br><br>Made in Vietnam."
257,"Sol patrol shirt - Go ahead. Go bone fishing. Ride your horse across the Red Desert. Live like a Gila monster, but wear this shirt so you don't end up looking like one. The Sol Patrol's lustrous, quick-drying and exceptionally soft polyester is woven extra-tightly to block out UV rays (30-UPF rating). The princess seaming and yoke detail add a feminine touch with a fit that offers plenty of room for active casting and rein retrieval. Cleanly styled, the sleeves roll up and fasten with hidden snaps, shirt tabs secure with snaps, and the concealed chest pocket zips closed. With a hemostat flap. Recyclable through the Common Threads Recycling Program.<br><br><b>Details:</b><ul> <li>""Quick-drying polyester with tight weave is exceptionally soft and light, with 30-UPF rating for sun protection""</li> <li>Hidden zippered chest pocket</li> <li>Flattering princess seaming and yoke detail</li> <li>Roll-up sleeve with fastener</li> <li>Hemostat flap</li></ul><br><br><b>Fabric: </b>2.2-oz 100% polyester ripstop with 30-UPF sun protection. Recyclable through the Common Threads Recycling Program<br><br><b>Weight: </b>(152 g 5.3 oz)<br><br>Made in Vietnam."
258,"Sport top - The loose, performance fit of the Women's Sport Top won't hike up or become annoyingly shifty during long-distance trail mileage. The extra-long, seamless racerback tank has a looser silhouette that increases airflow and eliminates hem migration. A comfortable built-in sports bra manages high impact activities; nylon/spandex (94%/6%) fabric blend provides moisture-wicking performance.<br><br><b>Details:</b><ul> <li>Supersoft nylon/spandex blend for next-to-skin comfort</li> <li>Seamless construction</li> <li>360-degree built-in sports bra</li> <li>""Perfect length for pairing with running shorts, yoga pants or everyday styles""</li></ul><br><br><b>Fabric: </b>Tank: 9.5-oz 94% nylon/6% spandex. Built-in sports bra: 9.5-oz 94% nylon/6% spandex. Both with moisture-wicking performance<br><br><b>Weight: </b>144 g (5.1 oz)<br><br>Made in Israel."
259,"Meridian board shorts - The stretchy Meridian Board Shorts accommodate floaters and drop-knee bottom-turns the globe over. The wide waistband has a snap fly with tie closure, and the 93% polyester (100% recycled)/7% spandex blend won't snag, chafe or bunch up during long paddles beyond the kelp forest. A back security pocket with key loop and zip closure means van keys and hunks of wax won't get lost in the spin cycle. Inseam (size 8) is 6"". Recyclable through the Common Threads Recycling Program.<br><br><b>Details:</b><ul> <li>Stretch-woven all-recycled polyester and spandex fabric for maximum mobility and comfort</li> <li>Snap fly with flat tie closure for secure fit</li> <li>Zippered welted pocket on hem with drain hole and key loop</li> <li>Low rise</li> <li>""Inseam is 6""""""</li></ul><br><br><b>Fabric: </b>5.4-oz 93% all-recycled polyester/7% spandex. Recyclable through the Common Threads Recycling Program<br><br><b>Weight: </b>(135 g 4.7 oz)<br><br>Made in Vietnam."
260,"Merino 1 crew - Our lightest merino layer, this silky-soft yet highly durable jersey-knit is made with 63% merino wool spun around an all-recycled polyester (37%) core. Super-comfortable on its own in warm temperatures or beneath layers in cooler ones, it offers great technical performance: naturally resisting odor, moving moisture away from the skin and improving dry times, regulating body temperature, and maintaining a consistent stretch. The neck - with a smooth self-fabric binding - invites ventilation but still covers a bra. We slow-wash our merino for next-to-skin softness. Machine-wash cold; lay flat to dry. Recyclable through the Common Threads Recycling Program.<br><br><b>Details:</b><ul> <li>""Slow-washed merino wool resists odor naturally, insulates even when wet, is durable, stretches and provides superior performance and softness""</li> <li>16.5 micron-gauge yarn and jersey-knit construction for luxurious hand</li> <li>""All-recycled polyester core wicks moisture, while wool next to skin controls odor""</li> <li>Softly scooped neckline ventilates while still covering bra</li> <li>Self-fabric neck binding for comfort</li> <li>Straight hem</li> <li>""Machine-wash cold, lay flat to dry""</li></ul><br><br><b>Fabric: </b>3.2-oz (108-g) 63% 16.5 micron chlorine-free merino wool/37% all-recycled polyester. Recyclable through the Common Threads Recycling Program<br><br><b>Weight: </b>(95 g 3.3 oz)<br><br>Made in USA."
261,"Print paries btm - Styled like a boy short, our Paries Bottoms fit low and straight across the hips, with medium coverage in front and full coverage in back. Lined front. Made from our improved fabric blend of 82% nylon/18% spandex.<br><br><b>Details:</b><ul> <li>Boy-short style</li> <li>Lined front</li> <li>Fits low and straight across hips</li> <li>Updated waist styling</li> <li>Medium coverage in front; full back coverage</li> <li>Improved fabric</li></ul><br><br><b>Fabric: </b>5.6-oz 82% nylon/18% spandex<br><br><b>Weight: </b>(54 g 1.9 oz)<br><br>Made in USA."
262,"Print sunamee btm - Stay-put Sunamees fit straight across the hips, with full coverage in back. Lined front. Made from a formfitting blend of 82% nylon/18% spandex.<br><br><b>Details:</b><ul> <li>Full coverage</li> <li>Lined front</li> <li>Fits straight across hips</li> <li>Regular rise</li> <li>Improved fabric</li></ul><br><br><b>Fabric: </b>5.6-oz 82% nylon/18% spandex<br><br><b>Weight: </b>(43 g 1.5 oz)<br><br>Made in USA."
263,"R1 full-zip jkt - It stretches, breathes, wicks and warms - no wonder so many serious trail and mountain athletes use and abuse our R1. And now it's even more versatile, with a full-zip front making it easier to use for everything from a midlayer in winter to a lightweight jacket on early spring mornings and alpine summer evenings. The high/low interior grid polyester enhances compressibility, airflow, insulation and dry time, and the jersey microfiber face allows smooth layering. Two zippered handwarmer pockets sit above the harness line and have glued-in (no seams) internal mesh pocket bags. Recyclable through the Common Threads Recycling Program.<br><br><b>Details:</b><ul> <li>""Versatile R1 fleece provides excellent stretch, warmth, wicking and breathability in a variety of temperatures""</li> <li>""High/low interior grid-structure enhances compressibility, airflow and dry time""</li> <li>Jersey microfiber face allows nonbinding layering</li> <li>Center-front zipper</li> <li>Handwarmer pockets</li></ul><br><br><b>Fabric: </b>R1: 6.5-oz Polartec Power Dry 93% polyester (60% recycled)/7% spandex. Recyclable through the Common Threads Recycling Program<br><br><b>Weight: </b>317 g (11.2 oz)<br><br>Made in Colombia."
264,"R1 p/o - Here's to trails that circle the globe and to never-ending hand cracks. And here's to staying mobile, comfortable and warm with the R1 Pullover's high/low grid polyester that stretches, breathes, moves moisture, and insulates. Sized to accommodate light underlayers, it works as a stand-alone top or as a light midlayer. Recyclable through the Common Threads Recycling Program.<br><br><b>Details:</b><ul> <li>""Recycled polyester R1 fabric provides excellent stretch, warmth, wicking and breathability in a variety of temperatures, whether worn as lightweight insulation or a thermal baselayer""</li> <li>Lightweight yarns wick moisture</li> <li>Outer microfiber yarns speed evaporation</li> <li>Interior grid enhances compressibility and airflow</li> <li>""Jersey microfiber face for low-friction, nonbinding layering""</li></ul><br><br><b>Fabric: </b>R1: 6.5-oz Polartec Power Dry 93% polyester (60% recycled)/7% spandex. Recyclable through the Common Threads Recycling Program<br><br><b>Weight: </b>257 g (9.1 oz)<br><br>Made in Colombia."
265,"Merino 1 t-shirt - So soft it's worth lingering in, our lightest merino layer is made with 63% merino wool spun around an all-recycled polyester (37%) core. Super-comfortable on its own in warm temperatures or beneath layers in cooler ones, this silky yet highly durable jersey-knit offers great technical performance: naturally resisting odor, moving moisture away from the skin and improving dry times, regulating body temperature, and maintaining a consistent stretch. The neck - with a smooth self-fabric binding - invites ventilation but still covers a bra. We slow-wash our merino for next-to-skin softness. Machine-wash cold; lay flat to dry. Recyclable through the Common Threads Recycling Program.<br><br><b>Details:</b><ul> <li>""Slow-washed merino wool resists odor naturally, insulates even when wet, is durable, stretches and provides superior performance and softness""</li> <li>16.5 micron-gauge yarn and jersey-knit construction for luxurious hand</li> <li>""All-recycled polyester core wicks moisture, while wool next to skin controls odor""</li> <li>Softly scooped neckline ventilates while still covering bra</li> <li>Self-fabric neck binding for comfort</li> <li>Straight hem</li> <li>""Machine-wash cold, lay flat to dry""</li></ul><br><br><b>Fabric: </b>3.2-oz (108-g) 63% 16.5 micron chlorine-free merino wool/37% all-recycled polyester. Recyclable through the Common Threads Recycling Program<br><br><b>Weight: </b>73 g (2.6 oz)<br><br>Made in USA."
266,"Merino 2 bottoms - Thankfully dry and warm when your forward progress is stop-and-go, these lightweight bottoms are made for an active lifestyle in warm to cool weather. Our most versatile merino layer, Merino 2 is made with 73% merino wool spun around an all-recycled polyester (27%) core for a luxurious hand, an improved dry time and enduring strength. Inherently soft and comfortable, merino naturally resists odor, moves moisture away from the skin, regulates body temperature, and stretches. A brushed-elastic waistband and offset inseams stay skin-friendly throughout a full day of active use. We slow-wash our merino for next-to-skin softness. Machine-wash cold; lay flat to dry. Recyclable through the Common Threads Recycling Program.<br><br><b>Details:</b><ul> <li>""Slow-washed merino wool resists odor naturally, insulates even when wet, is durable and stretches, provides superior performance and softness""</li> <li>18.5 micron-gauge yarn and jersey-knit construction for luxurious hand</li> <li>""All-recycled polyester core wicks moisture, while wool next to skin controls odor""</li> <li>Brushed elastic waistband and offset inseam for next-to-skin comfort</li> <li>""Machine-wash cold, lay flat to dry""</li></ul><br><br><b>Fabric: </b>4.85-oz (165-g) 73% chlorine-free merino wool/27% all-recycled polyester. Recyclable through the Common Threads Recycling Program<br><br><b>Weight: </b>(135 g 4.7 oz)<br><br>Made in USA."
267,"Storm light jkt - An emerging classic, inspired by the original Storm Jacket and holding true to timeless traits: It's waterproof, breathable and comfortable. Built for warm-weather use and engineered to be recycled at the end of its days, the Storm Light keeps you dry and in motion - from lowland treks to high-mountain passes. Full waterproof/breathable protection combines with a hanging mesh and taffeta liner for a soft, pliable, comfortable feel. Storm flaps cover the pit zips, the three external zippered pockets and the center-front 2-way zipper. Other details include a soft chamois chin guard, a 2-way-adjustable hood that rolls down into the microfleece-lined collar, an internal drop-in pocket and a drawcord hem. Cuffs secure with self-fabric tabs. Recyclable through the Common Threads Recycling Program.<br><br><b>Details:</b><ul> <li>2-layer polyester fabric with a waterproof/breathable H2No barrier and a hanging mesh-and-taffeta liner for greater comfort</li> <li>2-way-adjustable and stowable hood</li> <li>Soft chamois chin guard</li> <li>""Storm flaps on center-front zipper, pit zips, and external pocket zippers""</li> <li>""Pockets: two handwarmers with storm flaps; one forearm pocket, one internal drop-in""</li> <li>Cuffs secure with self-fabric tab</li> <li>Drawcord hem</li></ul><br><br><b>Fabric: </b>""Shell: 2-layer, 75-denier 3.8-oz 100% polyester laminate with a waterproof/breathable H2No barrier and Deluge DWR (durable water repellent) finish. Shell lining: 2.9-oz 100% all-recycled polyester mesh. Hood lining: 2.3-oz 50-denier 100%  all-recycled polyester taffeta. Collar lining and chin flap: 5.5-oz 100% polyester brushed jersey. Recyclable through the Common Threads Recycling Program""<br><br><b>Weight: </b>(652 g 22.6 oz)<br><br>Made in China."
268,"Stretch ascent jkt - Simple, stretchy, lightweight and waterproof. Made for alpine climbs where the realities include sideways-blowing sleet, our Stretch Ascent Jacket provides full stormproof protection and extraordinary breathability. The stretch-woven polyester (100% recycled) and waterproof/breathable barrier combine in a pliable 2.5-layer fabric package that enables your most limber moves. The roll-down, helmet-compatible hood adjusts in three ways with an easy-to-use single-pull system. A water-resistant, coated center-front zipper remains easy to open and close, the water-resistant external pocket zippers have zipper garages, and the third pocket is an internal drop-in. Cuffs secure with self-fabric tabs, and the hem's drawcord routes through the pockets. The hood's structured visor improves visibility in poor conditions. Recyclable through the Common Threads Recycling Program.<br><br><b>Details:</b><ul> <li>""Waterproof/breathable H2No, 2.5-layer stretch-woven shell""</li> <li>""Helmet-compatible, roll-down, single-pull 3-way-adjustable hood with laminated visor""</li> <li>Front zipper offers extreme water resistance and easy zipping</li> <li>""Pockets: two PU-coated zippered handwarmers with zipper garages, one internal drop-in""</li> <li>Cuffs secure with self-fabric hook-and-loop cuff closures</li> <li>Hem drawcord routed through pockets</li></ul><br><br><b>Fabric: </b>""2.5-layer, 50-denier 4.1-oz 100% all-recycled stretch-woven polyester with a waterproof/breathable H2No barrier and Deluge DWR (durable water repellent) finish. Recyclable through the Common Threads Recycling Program""<br><br><b>Weight: </b>439 g (15.5 oz)<br><br>Made in Vietnam."
269,"Merino 2 t-shirt - Our most versatile merino baselayer blends into your daily life like cream into coffee. This lightweight, highly livable tee is made from 73% merino wool spun around an all-recycled (27%) polyester core for a luxurious hand, an improved dry time and enduring strength. Inherently soft and comfortable, merino naturally resists odor, moves moisture away from the skin, regulates body temperature, and stretches. Raglan sleeves merge fluidly with the collar to avoid pack straps; side seams roll backward to eliminate chafing. With self-fabric collar binding for comfort. We slow-wash our merino for next-to-skin softness. Machine-wash cold; lay flat to dry. Recyclable through the Common Threads Recycling Program.<br><br><b>Details:</b><ul> <li>""Slow-washed merino wool resists odor naturally, insulates even when wet, is durable and stretches, provides superior performance and softness""</li> <li>18.5 micron-gauge yarn and jersey-knit construction for luxurious hand</li> <li>""All-recycled polyester core wicks moisture, while wool next to skin controls odor""</li> <li>Self fabric collar binding for comfort</li> <li>Raglan sleeves merge fluidly with collar out of the way of pack straps</li> <li>Side seams roll to the back to eliminate irritation</li> <li>""Machine-wash cold, lay flat to dry""</li></ul><br><br><b>Fabric: </b>4.85-oz (165-g) 73% chlorine-free merino wool/27% all-recycled polyester. Recyclable through the Common Threads Recycling Program<br><br><b>Weight: </b>(103 g 3.6 oz)<br><br>Made in USA."
270,"Merino 3 pants - These luxuriously soft pants have a silhouette like falling water and move gracefully from yoga to sharing a plate of penne puttanesca. They feature a smooth, double-layer self-fabric waistband that drops at the center-front to reduce bulk, a rear yoke for a flattering fit, and straight legs with forward-rolling side seams. Our go-to full-coverage wool layer, Merino 3 is made with 6.9-oz 100% merino wool that has an extra-fine-gauge yarn for softness and a jersey-knit construction for durability. Merino naturally resists odor, moves moisture away from the skin, regulates body temperature, and stretches to accommodate your every move. We slow-wash ours for next-to-skin softness. Machine-wash cold; lay flat to dry. Recyclable through the Common Threads Recycling Program.<br><br><b>Details:</b><ul> <li>""Slow-washed merino wool resists odor naturally, insulates even when wet, is exceptionally durable and stretches - providing superior performance  and softness""</li> <li>Fine 18.5 micron gauge yarn and jersey-knit construction for luxurious hand</li> <li>""Double-layer wide self fabric waistband, with internal elastic drops at center front, reduces waist bulk and provides good back coverage""</li> <li>Back yoke for flattering fit</li> <li>Straight leg silhouette</li> <li>Side seams roll to the front</li> <li>""Machine-wash cold, lay flat to dry""</li></ul><br><br><b>Fabric: </b>6.9-oz (230-g) 100% chlorine-free merino wool. Recyclable through the Common Threads Recycling Program<br><br><b>Weight: </b>(279 g 9.7 oz)<br><br>Made in USA."
271,"Morning glory dress - When onshore winds blow out your morning session, pull this irrepressible dress out of your pack and head to town. Made from a skin-soothing jersey knit (86% nylon/14% spandex), the Morning Glory keeps its shape. With an empire waist and back ties for infinite adjustability. Falls below the knee.<br><br><b>Details:</b><ul> <li>""Stretchy, soft, synthetic jersey knit; wicks moisture and dries fast; brushed interior""</li> <li>Halter-style with smooth neckband for comfort and mobility; empire waist; ties in back</li> <li>Below-knee length</li></ul><br><br><b>Fabric: </b>7-oz 86% nylon/14% spandex smooth-faced jersey knit with moisture-wicking performance<br><br><b>Weight: </b>314 g (11.1 oz)<br><br>Made in Colombia."
272,"Morning glory skirt - You can stand still and win a dance contest in this spirited 3-panel skirt. The soft, stretchy blend (92% nylon/8% spandex) moves on a whim and has a natural, playful drape. Pair it with a tank for a twirl around town or slip it on over yoga tights after class. The self-fabric waistband folds up or down. A flared hem and mid-calf length (28"" from waist to hem, size M) add a feminine silhouette.<br><br><b>Details:</b><ul> <li>""Ultrastretchy, soft, synthetic jersey knit; wicks moisture and dries fast; brushed interior""</li> <li>Self-fabric fold-over waistband rolls up or down; simple pull-on design</li> <li>""Length waist to hem (size M) is 28""""""</li></ul><br><br><b>Fabric: </b>6-oz 92% nylon/8% spandex smooth-faced jersey knit with moisture-wicking performance. Recyclable through the Common Threads Recycling Program<br><br><b>Weight: </b>320 g (11.3 oz)<br><br>Made in Mexico."
273,"Morning glory tights - This everyday essential features a clean-cut design in a stretch knit with excellent shape retention. The soft, substantial nylon blend (86% nylon/14% spandex) flows lightly over skin and dries quickly after a humid hike or passing squall. We've added topstitch detailing and a more contoured fit this season. The wide, low-rise waist provides chafe-free comfort. Inseam (size M) is 32"".<br><br><b>Details:</b><ul> <li>""Substantial, ultra-stretchy and soft synthetic knit with excellent shape retention; wicks moisture and dries fast""</li> <li>""Flattering, wide, flat waistband""</li> <li>""Curved back-yoke detailing and asymmetric side seams, contoured fit through thigh, slight flare at hem""</li> <li>Flat-seam construction is soft against skin</li> <li>Low rise</li> <li>""Inseam (size M) is 32""""""</li></ul><br><br><b>Fabric: </b>7-oz 86% nylon/14% spandex smooth-faced jersey knit with moisture-wicking performance<br><br><b>Weight: </b>(271 g 9.4 oz)<br><br>Made in Colombia."
